Unique ID,Title,Body,Season,Status,Image
item1,V-neck shirt,"Short Sleeve V-Neck Top, Short W/Belt Waist Not Adjustable.",season1,itemStatus1,ItemVariant1.0.jpg
item2,Vest dress,"Knee length dresses, no sleeves, double pocket",season3,itemStatus2,ItemVariant4.0.jpg
item3,Open sleeves shirt,"Loose, open sleeves shirt, no pockets",season3,itemStatus3,ItemVariant7.0.jpg
item4,Pearls Epaulets shirt,"Loose, short sleeves shirt, pearls Epaulets",season1,itemStatus2,ItemVariant11.0.jpg
item5,Mini dress,"Mini loose dress, short sleeves shirt, double pocket",season1,itemStatus1,ItemVariant13.0.jpg
